ID,Level,Type,Question,Agent_Answer,Score,Latency_Sec
1,Easy,Similarity,What are the main similarities between Skyrim and The Witcher 3? What would you recommend to someone who has played both?,"The main similarities between Skyrim and The Witcher 3 include their open-world exploration, engaging storytelling, complex characters, and deep combat mechanics. They also both have a strong focus on player choice and character customization. Based on these similarities, I recommend The Outer Worlds to someone who has played both Skyrim and The Witcher 3. The Outer Worlds is an open-world, role-playing game with a strong focus on exploration, combat, and character customization, and its Metacritic score of 80 indicates a well-received game. Additionally, Dragon's Dogma is also a good option, with its open-world, high-fantasy setting and strong focus on exploration, combat, and character customization.",90.0,8.8
2,Easy,GameInfo,How does the main mechanic (use of light) in Alan Wake integrate with the story?,"The main mechanic of using light in Alan Wake integrates with the story by symbolizing the struggle between light and darkness, or good and evil. The use of light to dispel the darkness that possesses the Taken enemies suggests that light is a powerful force that can be used to overcome the forces of darkness. This theme is consistent with the game's horror elements and its focus on storytelling, and is reinforced by the game's atmospheric and cinematic style. Overall, the use of light in Alan Wake is a key element of the game's narrative and gameplay, and helps to create a sense of tension and suspense that drives the player forward.",90.0,5.87
3,Easy,System,"I have a GTX 1650 GPU, can I play GTA V at 1080p high settings?","Unfortunately, your GTX 1650 GPU may not be able to handle GTA V at 1080p high settings, as the minimum recommended GPU is a GTX 970, which is more powerful than your current GPU. You may need to consider lowering the graphics settings or upgrading your GPU to play the game smoothly.",80.0,9.36
4,Easy,API,What is the release year of Elden Ring and who is its developer?,"The release year of Elden Ring is 2022, and it was developed by FromSoftware.",100.0,3.54
5,Easy,GameInfo,What is the starting point of the bond between Joel and Ellie in The Last of Us series?,"The starting point of the bond between Joel and Ellie in The Last of Us series is when Joel is tasked with escorting Ellie across the United States to the Fireflies' base, marking the beginning of their journey together and the development of their relationship.",100.0,5.32
6,Easy,Similarity,What is the difference in humor style between Saints Row and GTA V?,"The difference in humor style between Saints Row and GTA V is that Saints Row has a more overt, comedic, and exciting atmosphere, while GTA V has a more satirical and dark humor tone. Saints Row is known for its lack of serious tone and gritty realism, whereas GTA V has a more subtle and ironic approach to comedy. Overall, the two games have distinct humor styles that cater to different player preferences and expectations.",90.0,8.45
7,Easy,System,How much does using an SSD in a modern AAA game affect loading times?,"Using an SSD in a modern AAA game can significantly affect loading times, reducing them by up to 50-90% compared to traditional Hard Disk Drives (HDDs), resulting in a much faster and more seamless gaming experience.",100.0,4.48
8,Easy,API,Why do Red Dead Redemption 2's user and critic scores differ on Metacritic?,"The exact reason for the difference between Red Dead Redemption 2's user and critic scores on Metacritic is not available in our database. However, it is common for user and critic scores to differ due to various factors such as personal preferences, gameplay mechanics, and story. Red Dead Redemption 2 received widespread critical acclaim with a Metacritic score of 96, but the user score is not available in our records.",60.0,9.19
9,Easy,GameInfo,Why are bullets used as currency in the Metro 2033 universe?,"In the Metro 2033 universe, bullets are used as currency because of their value and scarcity in a post-apocalyptic world. The ability to defend oneself is crucial for survival, and ammunition becomes a highly sought-after resource. This unique economic system reflects the harsh conditions and the importance of weaponry in the game's world.",100.0,3.38
10,Easy,Similarity,What are the main design elements that make the Dark Souls series challenging?,"The main design elements that make the Dark Souls series challenging include:
1. Unforgiving difficulty: The series is known for its high level of difficulty, with tough enemies, traps, and boss battles that require skill and strategy to overcome.
2. Unique, overwhelming environments: The games feature vast, interconnected worlds with complex level design, hidden paths, and secret areas, which can be overwhelming and require careful exploration.
3. Combat mechanics: The series has a distinctive combat system that emphasizes timing, positioning, and strategy, with a focus on melee combat and defensive play.
4. Enemy placement and behavior: Enemies are often placed in strategic locations, and their behavior is designed to challenge the player, with some enemies being highly aggressive, while others are more stealthy or require specific tactics to defeat.
5. Limited resources and checkpoints: The series is known for its limited resources, such as estus flasks, and sparse checkpoints, which require players to be careful with their progress and manage their resources effectively.
6. Interconnected world design: The games feature interconnected worlds, where players can explore and discover new areas, but also get lost or disoriented, adding to the sense of challenge and adventure.
7. Atmospheric tension and fear: The series uses atmospheric sound design, visuals, and storytelling to create a sense of tension and fear, which can make the game more challenging and immersive.

These design elements combine to create a challenging and rewarding experience that requires players to be skilled, strategic, and patient.",80.0,5.82
11,Easy,System,Why is 8GB of RAM considered a 'bottleneck' in games today?,Platformlar: PC,0.0,14.58
12,Easy,API,In which year was the PC version of Ghost of Tsushima released?,"The PC version of Ghost of Tsushima was released in 2022, but the exact date provided by the tool is not available. According to external knowledge, it was released on August 29, 2022, for Steam.",0.0,4.33
13,Easy,GameInfo,Compare the 'Night City' atmosphere in Cyberpunk 2077 with the movie Blade Runner.,"The 'Night City' atmosphere in Cyberpunk 2077 and the movie Blade Runner share a common thread in their dystopian and futuristic settings, characterized by corporate dominance and advanced technology. While both worlds are marked by a blurring of lines between human and artificial life forms, they differ in their narrative focuses. Blade Runner is a profound exploration of what it means to be human, whereas Cyberpunk 2077 examines the consequences of unchecked technological progress and the pervasive influence of corporations on society. This comparison highlights the distinct thematic directions of these two sci-fi staples, despite their shared atmospheric and conceptual foundations.",90.0,5.54
14,Easy,Similarity,"In stealth-focused games like Dishonored, how does the 'chaos level' affect gameplay?","The 'chaos level' in Dishonored affects gameplay by tracking the player's actions and their impact on the game world. A high chaos level indicates a more aggressive and violent approach, while a low chaos level indicates a more stealthy and non-lethal approach. The chaos level influences the game's story, characters, and ending, with a high chaos level leading to a darker and more violent conclusion.",90.0,4.14
15,Easy,System,How does installing too many mods in Skyrim affect system requirements?,"Installing too many mods in Skyrim, especially script-heavy ones, can increase the system requirements beyond the baseline specs of 8 GB RAM and a GTX 470 GPU. The exact increase in requirements would depend on the nature and number of mods installed, but as a general guideline, more powerful hardware (such as more RAM and a stronger GPU) may be necessary for smooth performance with a heavily modded game.",90.0,8.69
16,Medium,Similarity,Recommend a game that combines Skyrim's sense of exploration with a darker theme and challenging combat.,"I recommend The Witcher 3: Wild Hunt, an action role-playing game that combines a dark fantasy theme with challenging combat mechanics and a deep storyline. The game offers a vast open world to explore, engaging characters, and a variety of quests and missions to complete. With its high Metacritic score and positive reviews, The Witcher 3 is an excellent choice for fans of Skyrim and dark fantasy games. Additionally, Dishonored 2 is also a great option, with its stealth-based gameplay and dark atmosphere, but The Witcher 3 seems to be a more fitting recommendation based on the provided information.",60.0,7.65
17,Medium,GameInfo,Why is Metro Exodus's open-world structure different from previous games in the series?,"Metro Exodus's open-world structure is different from previous games in the series because it represents a deliberate design choice to move away from the linear, story-driven approach of the earlier games and towards a more open-world, sandbox-style experience. This change allows players to explore a wider range of environments, complete side quests, and engage in more emergent gameplay, while still maintaining the series' trademark atmosphere and storytelling.",90.0,5.25
18,Medium,System,Can a laptop with RTX 3050 Ti run Elden Ring smoothly with Ray Tracing on?,"I could not find the specific system requirements for Elden Ring with Ray Tracing in my database or API. However, based on general knowledge, running Elden Ring with Ray Tracing on a laptop with an RTX 3050 Ti may not result in smooth performance, especially at high graphics settings. The RTX 3050 Ti can handle Ray Tracing in less demanding games or at lower settings, but Elden Ring's demands might exceed the capabilities of this GPU, potentially leading to reduced frame rates or the need to lower graphics settings for playable performance.",80.0,7.34
19,Medium,API,Does the general player score of Cyberpunk 2077 'Phantom Liberty' DLC surpass the base game?,"The general player score of Cyberpunk 2077 'Phantom Liberty' DLC, as indicated by the reyting (0-5) score of 4.7, appears to surpass the base game's score of 4.22. However, the Metacritic score for the DLC is not available, so we cannot make a direct comparison using Metacritic scores.",80.0,5.46
20,Medium,Mixed,Compare the system requirements of post-apocalyptic games Fallout 4 and Metro 2033 and comment on which is better optimized.,"Based on the system requirements, Metro 2033 appears to be better optimized than Fallout 4. Metro 2033 can run on lower-end hardware, including a GTX 460 and 4 GB of RAM, whereas Fallout 4 requires a more powerful GTX 780 and 8 GB of RAM. This suggests that Metro 2033 is more efficient in its use of system resources, making it a better option for players with lower-end hardware. However, it's worth noting that Fallout 4's more demanding requirements may be due to its more complex game engine and larger open world.",90.0,6.47
21,Medium,Similarity,Which games tell an emotional story like The Last of Us but have gameplay similar to Detroit: Become Human?,"Based on the information gathered, Life Is Strange is a game that tells an emotional story like The Last of Us and has gameplay similar to Detroit: Become Human. It features interactive drama, player choice, and emotional storytelling, making it a good match for players who enjoy games with strong narrative focus and player agency.",80.0,11.06
22,Medium,GameInfo,What is the 'Push Forward Combat' philosophy in Doom (2016)?,"The 'Push Forward Combat' philosophy in Doom (2016) is a design approach that encourages players to be aggressive and constantly move forward, rather than taking cover or playing defensively, reflecting the game's fast-paced action and emphasis on Glory Kills.",90.0,3.37
23,Medium,System,"Based on leaked information about GTA 6, will 16GB RAM remain standard or will 32GB be required?","Based on the current trends in AAA game development and the lack of concrete information about GTA 6's system requirements, it's likely that 16GB RAM will still be a viable option for playing GTA 6, but 32GB may be recommended for optimal performance. However, without official system requirements, it's difficult to make a definitive statement.",80.0,6.06
24,Medium,API,Give examples of the 3 open-world games that run most smoothly on the Steam Deck.,"The three open-world games that are likely to run most smoothly on the Steam Deck are Horizon Zero Dawn, The Witcher 3, and Elden Ring. These games are all highly rated, available on PC, and have been well-optimized for performance, making them good candidates for smooth gameplay on the Steam Deck.",90.0,9.03
25,Medium,Mixed,Explain the technological difference between the announced system requirements of S.T.A.L.K.E.R. 2 and the first game.,"The technological difference between the announced system requirements of S.T.A.L.K.E.R. 2 and the first game is significant, with S.T.A.L.K.E.R. 2 requiring much more powerful hardware to run. This is due to the advancements in game engine technology, graphics, and gameplay mechanics over the past 17 years. Unfortunately, we couldn't find the exact system requirements for S.T.A.L.K.E.R. 2, but we can expect that it would require a modern gaming PC with a multi-core processor, high-end graphics card, and plenty of RAM.",20.0,9.91
26,Medium,GameInfo,What is the difference between 'Karma' and 'Reputation' systems in Fallout New Vegas?,"In Fallout New Vegas, 'Karma' and 'Reputation' are two distinct systems. 'Karma' represents the player's moral alignment, which is affected by their actions and choices throughout the game. 'Reputation', on the other hand, refers to the player's standing with various factions in the game world, such as the NCR, Caesar's Legion, or the Brotherhood of Steel. While Karma is a more general measure of the player's morality, Reputation is specific to each faction and can influence how non-playable characters (NPCs) interact with the player and the opportunities available to them.",100.0,3.64
27,Medium,Similarity,Recommend modern open-world games with realistic physics and no fantasy elements.,"Based on the search results, I recommend the following modern open-world games with realistic physics and no fantasy elements: 
1. Grand Theft Auto V - an open-world crime game with realistic physics and a satirical tone, set in the city of Los Santos.
2. Grand Theft Auto IV - an open-world crime game with realistic physics, set in the city of Liberty City.
Both games offer a realistic and immersive open-world experience with a focus on crime and narrative-driven storytelling.",80.0,5.73
28,Medium,System,What is the biggest weakness of the GTX 1650 GPU in AAA games in 2024?,"The biggest weakness of the GTX 1650 GPU in AAA games in 2024 is its limited graphics processing power, which may cause it to struggle with running demanding games at high graphics settings, particularly those that require more powerful GPUs like the GTX 970 or GTX 1060.",20.0,7.93
29,Medium,API,How do free games offered on Epic Games Store affect the sales of the game?,"Offering free games on the Epic Games Store can positively affect the sales of a game by increasing its visibility, attracting new players, and potentially leading to increased sales of DLCs, sequels, or other games from the same developer. However, the exact impact on sales can vary depending on the game, its genre, the target audience, and how the promotion is executed. Unfortunately, specific data on the impact of Epic Games Store's free game promotions on game sales could not be found using the available tools.",90.0,7.02
30,Medium,GameInfo,How does the Nemesis system in Shadow of War evolve based on player choices?,"The Nemesis system in Shadow of War evolves based on player choices, such as defeating or sparing certain orcs, which can lead to the creation of new enemies or allies. The player's actions can influence the strengths, weaknesses, and personalities of the orcs, making each playthrough unique. The system allows for the creation of a personal storyline, where the player's choices and actions can lead to the rise of a new orc leader or the downfall of an existing one.",80.0,3.91
31,Hard,Similarity,"For a game experience that combines Stalker's survival mechanics with Skyrim's moddability, which titles should be considered?","For a game experience that combines S.T.A.L.K.E.R.'s survival mechanics with Skyrim's moddability, consider Fallout New Vegas and Fallout 4. Both games offer a rich open-world experience with strong survival elements and have active modding communities, allowing for extensive customization and enhancement of gameplay mechanics.",80.0,10.01
32,Hard,GameInfo,Which parts of Elden Ring's storytelling did George R.R. Martin contribute to?,"George R.R. Martin contributed to the world-building and lore of Elden Ring, working closely with the game's director to create the game's complex and rich world, including its history, geography, and mythology.",90.0,4.62
33,Hard,Mixed,"I'm looking for a Skyrim-like game, my system has i3-10100F and 8GB RAM. Can I play Elden Ring on low settings or should I choose Witcher 3?","Based on the available information, it's likely that your system can handle The Witcher 3: Wild Hunt, but we cannot confirm whether your system can run Elden Ring on low settings due to the lack of system requirements data. The Witcher 3: Wild Hunt is a suitable alternative, considering your system meets the minimum RAM requirement and has a similar system rank to Skyrim.",90.0,13.05
34,Hard,EdgeCase,"For an RPG experience with a minimalist UI focused entirely on atmosphere, which games should be preferred?","For an RPG experience with a minimalist UI focused entirely on atmosphere, Hades (2020) is a highly recommended game. It has a high Metacritic score of 93, and it is known for its atmospheric and storytelling-focused approach. The game also has a minimalist UI, which fits the user's criteria. Other games that may fit the criteria include What Remains of Edith Finch and Path of Exile, but Hades seems to be the best match based on the information provided.",20.0,11.34
35,Hard,Mixed,Compare the lighting technologies of Metro Exodus and Cyberpunk 2077's graphics engines (4A Engine vs REDEngine).,"The 4A Engine, used in Metro Exodus, and the REDEngine, used in Cyberpunk 2077, both feature advanced lighting capabilities, including global illumination, dynamic lighting, and detailed shading. The 4A Engine features a proprietary lighting technology called ""Global Illumination 2.0"", while the REDEngine features a technology called ""Ray Tracing"". Both engines are capable of producing highly realistic and detailed lighting in their respective games. However, the specific details of their lighting technologies are not available through the game_api_tool or game_info_tool.",90.0,8.77
36,Hard,API,Which game studios have released multiple games with 90+ Metacritic scores in the last 5 years?,"The game studios that have released multiple games with 90+ Metacritic scores in the last 5 years are Naughty Dog and possibly Rockstar Games, although Rockstar Games has only released one game in the last 5 years with a 90+ Metacritic score.",0.0,13.73
37,Hard,GameInfo,What is the canonical link between Metro 2033's 'Bad Ending' and the start of Last Light?,"The canonical link between Metro 2033's 'Bad Ending' and the start of Metro: Last Light is that the 'Bad Ending' of Metro 2033, where Artyom destroys the Dark Ones, sets the stage for the events of Metro: Last Light. The destruction of the Dark Ones has significant consequences on the world of Metro, leading to the events and story of Metro: Last Light.",90.0,5.99
38,Hard,Similarity,"List non-violent, exploration-focused games similar to 'Journey' that stand out for their visual design.","Non-violent, exploration-focused games similar to 'Journey' that stand out for their visual design include:
1. Gris - a beautiful and emotional experience with a strong focus on artistic and visual design.
2. Flower - a serene and visually stunning game that allows players to explore and interact with a beautiful environment.
3. Abzû - an underwater exploration game with a strong focus on artistic and visually stunning experience.

These games offer a similar experience to Journey in terms of their non-violent and exploration-focused gameplay, and standout visual design.",90.0,12.61
39,Hard,EdgeCase,"For someone with an old system (8GB RAM, GTX 750 Ti) wanting to play open-world RPGs, would you recommend Witcher 3 or Starfield? Why?","Based on the available information and considering the user's old system (8GB RAM, GTX 750 Ti), I would recommend The Witcher 3 over Starfield. While the user's GPU is not the recommended minimum for The Witcher 3, it's closer to meeting those requirements than it would be for Starfield, given the general trend of increasing system requirements in newer games. The Witcher 3, despite potential performance issues, is more likely to be playable on the user's system than Starfield.",90.0,7.31
40,Hard,Extreme,Do 'Recommended' settings in a game's system requirements target 1080p 60 FPS or 4K 30 FPS? Explain using Metro Exodus as an example.,"I could not find Metro Exodus in my database or API to determine the target resolution and framerate for its 'Recommended' system settings. Typically, 'Recommended' settings in a game's system requirements target a smooth gaming experience at a certain resolution, often 1080p or 1440p, at 60 FPS. However, without the specific system requirements for Metro Exodus, I cannot provide a definitive answer.",70.0,5.95
41,Medium,GameInfo,Explain the game loop that creates the 'One More Turn' effect in strategy games like Civilization V.,"The 'One More Turn' effect in Civilization V is created by a combination of turn-based strategy, resource management, progression systems, and goal-oriented design. The game's design encourages players to take just one more turn to achieve specific goals, such as researching a new technology, building a new wonder, or conquering a nearby city. This creates a sense of engagement and progression, making it difficult for players to stop playing and contributing to the 'One More Turn' effect.",90.0,6.0
42,Medium,System,Illustrate the difference between CPU-intensive and GPU-intensive games using Cities Skylines and Cyberpunk 2077 as examples.,"The main difference between CPU-intensive and GPU-intensive games can be illustrated using Cities Skylines and Cyberpunk 2077 as examples. Cities Skylines is a CPU-intensive game that requires a quad-core CPU to handle complex city simulations and management tasks, with a relatively low GPU power level requirement (4/10). In contrast, Cyberpunk 2077 is a more GPU-intensive game that requires a higher-end GPU (GTX 1060) and has a higher GPU power level requirement (6/10), although it also requires a quad-core CPU and 12 GB of RAM for smoother performance. This comparison highlights the distinct requirements of different genres and gameplay styles, with CPU-intensive games like Cities Skylines focusing on complex simulations and management tasks, and GPU-intensive games like Cyberpunk 2077 requiring more powerful graphics processing to handle demanding visuals and gameplay.",90.0,5.31
43,Hard,Similarity,Compare the 'meta-progression' system in roguelikes like Hades and Dead Cells that keeps players trying repeatedly.,"The meta-progression systems in Hades and Dead Cells share similarities in that both games offer persistent upgrades and unlockables that encourage repeated playthroughs. However, without specific details on Dead Cells' system from the tools, we can infer based on general knowledge that both games utilize meta-progression to keep players engaged. In Hades, this includes upgrades and unlocks that persist across deaths, while Dead Cells likely employs a similar strategy with its cells, weapons, and mutations. The exact mechanics may differ, but the goal of motivating players through persistent progress is a common thread between these roguelike games.",90.0,13.23
44,Easy,API,"Which game service (Game Pass, PS Plus, etc.) offers more 'Day One' games in its library?","Based on publicly available information, Xbox Game Pass is known to offer a large number of 'Day One' games, including titles from Microsoft's own studios and other publishers. PlayStation Plus also offers 'Day One' games, but the selection is generally smaller compared to Xbox Game Pass. However, it's worth noting that the availability of 'Day One' games can vary depending on the region and the specific services offered. Therefore, the answer to the question is that Xbox Game Pass generally offers more 'Day One' games in its library compared to PlayStation Plus.",100.0,8.83
45,Medium,Mixed,"Despite the similarities between Terraria and Minecraft, argue why Terraria is more 'RPG-focused'.","Terraria is more 'RPG-focused' than Minecraft due to its emphasis on character progression, loot systems, and combat mechanics. The game's 2D action-adventure design and use of character creation, randomly generated maps, and boss battles also suggest a stronger focus on RPG elements. While Minecraft has some RPG elements, its overall design and gameplay mechanics prioritize sandbox creativity and survival over character development and storytelling, making Terraria a more RPG-focused experience.",90.0,6.01
