ID,Level,Type,Question,Agent_Answer,Score,Latency_Sec
46,Hard,EdgeCase,How does running a game only on Linux via Proton affect performance? Consider Elden Ring as an example.,"Running Elden Ring on Linux via Proton can potentially introduce some performance overhead due to the compatibility layer translating Windows API calls to Linux. However, the exact impact on performance can vary depending on the specific hardware and the game itself. In general, Proton has made significant strides in improving compatibility and performance for many Windows games on Linux, but the performance might still be slightly lower compared to running the game natively on Windows. For the most accurate assessment, it's recommended to consult specific benchmarks or community feedback for Elden Ring on Linux via Proton.",80.0,8.43
47,Medium,GameInfo,Explain the concept of 'Environmental Storytelling' in the Bioshock series with an example.,"The concept of 'Environmental Storytelling' in the Bioshock series refers to the use of the environment and setting to convey the story, themes, and atmosphere of the game. For example, in the first Bioshock game, the city of Rapture is a prime example of Environmental Storytelling. The city's decrepit and crumbling state, with its leaking pipes, flickering lights, and abandoned buildings, tells the story of a once-great utopia that has fallen into chaos and decay. The environment also conveys the themes of objectivism and the dangers of unchecked scientific progress, as seen in the various audio diaries and posters scattered throughout the city. This narrative technique allows players to piece together the story and themes of the game through their exploration of the environment, creating a more immersive and engaging experience.",90.0,4.67
48,Hard,System,Do DLSS 3.0 and Frame Generation technology really solve CPU bottlenecks in games like Cyberpunk 2077?,"DLSS 3.0 and Frame Generation technology can indirectly help mitigate CPU bottlenecks in games like Cyberpunk 2077 by reducing the GPU's workload and potentially offloading some CPU-intensive tasks. However, they do not directly solve CPU bottlenecks, as their primary function is to enhance GPU performance. The actual impact on CPU bottlenecks would depend on the game's optimization for these technologies and the hardware setup. Therefore, while DLSS 3.0 and Frame Generation can contribute to a smoother gaming experience, they are not a direct solution for CPU bottlenecks.",80.0,7.64
49,Easy,Similarity,How does Rocket League blend sports and racing genres? Is there any similar game?,"Rocket League blends sports and racing genres by combining soccer gameplay with high-speed cars, boosters, and acrobatic stunts. The game's unique blend of physics-based gameplay and competitive multiplayer modes sets it apart from traditional sports and racing games. If you're looking for similar games, you might enjoy FIFA, Trackmania, Fall Guys, Knockout City, and SpeedRunners, which offer a mix of high-speed action, competitive multiplayer, and physics-based gameplay.",90.0,4.44
50,Extreme,Mixed,Analyze which game exerts more pressure on the player by comparing the moral dilemmas in Detroit: Become Human with the 'gray area' choices in Witcher 3.,"The Witcher 3 exerts more pressure on the player due to its complex moral ambiguities and uncertainties, requiring the player to navigate a complex web of moral dilemmas and make difficult choices that have significant consequences for the story and its characters.",90.0,12.74
SUMMARY,ALL,TOTAL,AVERAGE PERFORMANCE,N/A,77.8,7.44
